{
    "audit_log_transfer_destinations": {
        "ansible_facts": {
            "audit_log_transfer_dest_info": {
                "is_detailed": true,
                "location_name": "",
                "primary_syslog_server": {
                    "ip_address": "",
                    "is_enabled": false,
                    "port": -1
                },
                "retries": null,
                "retry_interval": -1,
                "secondary_syslog_server": {
                    "ip_address": "",
                    "is_enabled": false,
                    "port": -1
                },
                "transfer_protocol": "UDP"
            },
            "user_consent_required": "Hitachi Vantara LLC collects usage data such as storage model, storage serial number, operation name, status (success or failure),and duration. This data is collected for product improvement purposes only. It remains confidential and it is not shared with any third parties. To provide your consent, run the accept_user_consent.yml playbook."
        },
        "changed": false,
        "failed": false
    },
    "channel_boards": {
        "ansible_facts": {
            "channel_boards": [
                {
                    "cable_material": "-",
                    "channel_board_id": 0,
                    "channel_board_number": 0,
                    "channel_board_type": "FIBRE",
                    "cluster_number": 1,
                    "location": "CHB-1A",
                    "max_port_speed": "32G",
                    "num_of_ports": "4Port",
                    "storage_serial_number": "454972"
                },
                {
                    "cable_material": "Optical",
                    "channel_board_id": 1,
                    "channel_board_number": 1,
                    "channel_board_type": "ISCSI",
                    "cluster_number": 1,
                    "location": "CHB-1B",
                    "max_port_speed": "10G",
                    "num_of_ports": "2Port",
                    "storage_serial_number": "454972"
                },
                {
                    "cable_material": "-",
                    "channel_board_id": 2,
                    "channel_board_number": 0,
                    "channel_board_type": "FIBRE",
                    "cluster_number": 2,
                    "location": "CHB-2A",
                    "max_port_speed": "32G",
                    "num_of_ports": "4Port",
                    "storage_serial_number": "454972"
                },
                {
                    "cable_material": "Optical",
                    "channel_board_id": 3,
                    "channel_board_number": 1,
                    "channel_board_type": "ISCSI",
                    "cluster_number": 2,
                    "location": "CHB-2B",
                    "max_port_speed": "10G",
                    "num_of_ports": "2Port",
                    "storage_serial_number": "454972"
                }
            ],
            "user_consent_required": "Hitachi Vantara LLC collects usage data such as storage model, storage serial number, operation name, status (success or failure),and duration. This data is collected for product improvement purposes only. It remains confidential and it is not shared with any third parties. To provide your consent, run the accept_user_consent.yml playbook."
        },
        "changed": false,
        "failed": false
    },
    "clpr": {
        "ansible_facts": {
            "clprs": [
                {
                    "cache_memory_capacity_in_gb": 90.75,
                    "cache_memory_capacity_in_mb": 92928,
                    "cache_memory_used_capacity_in_gb": 0.044921875,
                    "cache_memory_used_capacity_in_mb": 46,
                    "cache_usage_rate": 1,
                    "clpr_id": 0,
                    "clpr_name": "CLPR0",
                    "side_files_capacity_in_gb": 0.0,
                    "side_files_capacity_in_mb": 0,
                    "side_files_usage_rate": 0,
                    "write_pending_data_capacity_in_gb": 0.0,
                    "write_pending_data_capacity_in_mb": 0,
                    "write_pending_data_rate": 0
                }
            ],
            "msg": "CLPRs retrieved successfully",
            "user_consent_required": "Hitachi Vantara LLC collects usage data such as storage model, storage serial number, operation name, status (success or failure),and duration. This data is collected for product improvement purposes only. It remains confidential and it is not shared with any third parties. To provide your consent, run the accept_user_consent.yml playbook."
        },
        "changed": false,
        "failed": false
    },
    "disk_drives": {
        "ansible_facts": {
            "disk_drives": {
                "data": [
                    {
                        "drive_location_id": "0-0",
                        "drive_type": "SLB5J-M1R9SS",
                        "drive_type_name": "SSD(MLC)",
                        "parity_group_id": "1-2",
                        "serial_number": "F3702DEZ",
                        "status": "NML",
                        "total_capacity": "1900 GB",
                        "total_capacity_mb": 1945600.0,
                        "usage_type": "DATA"
                    },
                    {
                        "drive_location_id": "0-1",
                        "drive_type": "SLB5J-M1R9SS",
                        "drive_type_name": "SSD(MLC)",
                        "parity_group_id": "1-2",
                        "serial_number": "F3702DEU",
                        "status": "NML",
                        "total_capacity": "1900 GB",
                        "total_capacity_mb": 1945600.0,
                        "usage_type": "DATA"
                    },
                    {
                        "drive_location_id": "0-2",
                        "drive_type": "SLB5J-M1R9SS",
                        "drive_type_name": "SSD(MLC)",
                        "parity_group_id": "1-2",
                        "serial_number": "F3702CY4",
                        "status": "NML",
                        "total_capacity": "1900 GB",
                        "total_capacity_mb": 1945600.0,
                        "usage_type": "DATA"
                    },
                    {
                        "drive_location_id": "0-3",
                        "drive_type": "SLB5J-M1R9SS",
                        "drive_type_name": "SSD(MLC)",
                        "parity_group_id": "1-2",
                        "serial_number": "F3702CY3",
                        "status": "NML",
                        "total_capacity": "1900 GB",
                        "total_capacity_mb": 1945600.0,
                        "usage_type": "DATA"
                    },
                    {
                        "drive_location_id": "0-4",
                        "drive_type": "SLB5J-M1R9SS",
                        "drive_type_name": "SSD(MLC)",
                        "parity_group_id": "1-2",
                        "serial_number": "F3702DEX",
                        "status": "NML",
                        "total_capacity": "1900 GB",
                        "total_capacity_mb": 1945600.0,
                        "usage_type": "DATA"
                    },
                    {
                        "drive_location_id": "0-5",
                        "drive_type": "SLB5J-M1R9SS",
                        "drive_type_name": "SSD(MLC)",
                        "parity_group_id": "1-2",
                        "serial_number": "F3702CY0",
                        "status": "NML",
                        "total_capacity": "1900 GB",
                        "total_capacity_mb": 1945600.0,
                        "usage_type": "DATA"
                    },
                    {
                        "drive_location_id": "0-6",
                        "drive_type": "SLB5J-M1R9SS",
                        "drive_type_name": "SSD(MLC)",
                        "parity_group_id": "1-2",
                        "serial_number": "F3702CXY",
                        "status": "NML",
                        "total_capacity": "1900 GB",
                        "total_capacity_mb": 1945600.0,
                        "usage_type": "DATA"
                    },
                    {
                        "drive_location_id": "0-7",
                        "drive_type": "SLB5J-M1R9SS",
                        "drive_type_name": "SSD(MLC)",
                        "parity_group_id": "1-2",
                        "serial_number": "F3702CXX",
                        "status": "NML",
                        "total_capacity": "1900 GB",
                        "total_capacity_mb": 1945600.0,
                        "usage_type": "DATA"
                    },
                    {
                        "drive_location_id": "0-8",
                        "drive_type": "SLR5E-M7R6SS",
                        "drive_type_name": "SSD(MLC)",
                        "parity_group_id": "1-1",
                        "serial_number": "50V0A07X",
                        "status": "NML",
                        "total_capacity": "7600 GB",
                        "total_capacity_mb": 7782400.0,
                        "usage_type": "DATA"
                    },
                    {
                        "drive_location_id": "0-9",
                        "drive_type": "SLR5E-M7R6SS",
                        "drive_type_name": "SSD(MLC)",
                        "parity_group_id": "1-1",
                        "serial_number": "50V09M1X",
                        "status": "NML",
                        "total_capacity": "7600 GB",
                        "total_capacity_mb": 7782400.0,
                        "usage_type": "DATA"
                    },
                    {
                        "drive_location_id": "0-10",